{
  "$schema": "./rinspace-stack-baseline.schema.json",
  "schemaVersion": "rinspace-stack-baseline/v1",
  "recordedOn": "2026-09-05",
  "status": "development-baseline",
  "components": {
    "rinspaceWeb": {
      "repository": "rinspacehq/rinspace-web",
      "visibility": "public",
      "commit": "d8878c0ddc10275f0ae0cac2ef726c418fcb5b20",
      "version": "0.1.0",
      "node": "22.x",
      "packageManager": "pnpm@9.7.0",
      "react": "19.2.8",
      "router": "7.x",
      "vite": "6.4.3"
    },
    "mastodon": {
      "repository": "rinspacehq/mastodon",
      "visibility": "public",
      "commit": "0a32b4a831838ef1f363a915c2e71e2a1b52cf0d",
      "upstreamRepository": "mastodon/mastodon",
      "upstreamCommit": "0a32b4a831838ef1f363a915c2e71e2a1b52cf0d",
      "describe": "v4.7.0-beta.1-180-g0a32b4a83",
      "forkPatchCount": 0,
      "ruby": "4.0.6",
      "node": ">=22",
      "packageManager": "yarn@4.18.0",
      "react": "19.2.8",
      "router": "5.3.4",
      "vite": "8.2.1",
      "postgres": "14",
      "redis": "7"
    },
    "rinspacePrivate": {
      "repository": "rinspacehq/rinspace",
      "visibility": "private",
      "commit": "d5e83cb83577e0935ebd20665782884de75643cd",
      "releaseTag": "rinspace-ui-build-d5e83cb83577e0935ebd20665782884de75643cd",
      "version": "0.1.0",
      "packageManager": "pnpm@9.7.0",
      "publicUiReact": "19.2.8",
      "publicUiRouter": "7.x",
      "publicUiVite": "6.4.3"
    }
  },
  "compatibility": {
    "worldRouteContract": "1.x",
    "worldShell": "0.1.x",
    "reactPeer": "^19.0.0",
    "releaseRule": "exact-commit-and-artifact-digest",
    "floatingReferencesAllowed": false
  },
  "forkPatchPolicy": {
    "categories": ["upstreamable", "rinspace-product", "long-lived-safety"],
    "requiredEvidence": [
      "upstream-base",
      "changed-files",
      "verification",
      "license-impact",
      "upgrade-notes"
    ]
  }
}
